{
  "schema_version": "1.0.0",
  "policy_id": "MF-CHAIDEZ-CATALOG-BOUNDARY-001",
  "programme_authority": {
    "repository": "grandchallenge/MATH-PROGRAMME",
    "commit": "861479cb599df01f6e9cafc8647fdefe56249d29",
    "path": "pedagogy/chaidez_protocol_contract.json",
    "git_blob_sha1": "29e12c793d116c6c3af121c04486c5daa6c09e1e"
  },
  "catalog_entry_disposition": "SOURCE_RECORD_ONLY",
  "chaidez_dossier_at_ingestion": false,
  "promotion_trigger": "REVIEWED_PROMOTION_TO_MATHSOLVE",
  "minimum_proposal_assurance_tier": "SEMANTICALLY_REVIEWED",
  "exact_campaign_target_assurance_tier": "CAMPAIGN_CONCORDANT",
  "automatic_promotion": false,
  "claim_boundary": "MATHFORGE preserves and reviews external source records. Catalog ingestion, normalization, semantic review, and campaign concordance do not create a Chaidez work package. A full dossier is required only when a qualified reviewed promotion is handed to MATHSOLVE; no catalog tier proves or certifies a claim."
}
